,Course_ID,Course_Name,Course_Description
0,1,Introduction to Psychology,"This course provides an overview of the basic principles and theories of psychology. Students will learn about the different approaches to studying behavior and mental processes, including biological, cognitive, and psychodynamic perspectives. Topics covered may include perception, learning, memory, motivation, emotion, personality, and social behavior. The course may also cover research methods used in psychology, including experiments, surveys, and case studies."
1,2,Calculus for Engineers,"This course covers the fundamental concepts of calculus, with an emphasis on applications in engineering and the physical sciences. Students will learn about limits, derivatives, integrals, and differential equations, as well as topics such as optimization and curve sketching. The course may also cover multivariable calculus and vector calculus."
2,3,Creative Writing Workshop,"This course is designed to help students develop their skills in writing fiction, poetry, and creative nonfiction. Students will participate in workshops where they give and receive feedback on their work, as well as receive instruction on various aspects of the writing process such as character development, plot, dialogue, and style."
3,4,Principles of Marketing,"This course introduces students to the principles and practices of marketing. Topics covered may include market research, segmentation, product development, pricing, advertising, and distribution. The course may also cover digital marketing and social media."
4,5,World History,"A Global Perspective: This course provides an overview of world history from ancient times to the present day, with an emphasis on global connections and interactions. Students will learn about the rise and fall of civilizations, the spread of religions and ideas, and the impact of trade, war, and colonialism. The course may also cover the history of science and technology."
5,6,Introduction to Computer Science,"This course introduces students to the basic concepts of computer science. Students will learn about programming, algorithms, data structures, and computer systems. The course may also cover computer networks, operating systems, and software development."
6,7,Biology of Human Health and Disease,"This course explores the biological basis of human health and disease. Topics covered may include genetics, cellular biology, immunology, and microbiology. The course may also cover diseases such as cancer, diabetes, and infectious diseases."
7,8,Environmental Ethics and Sustainability,"This course examines ethical issues related to environmental sustainability. Topics covered may include climate change, pollution, biodiversity loss, and resource depletion. The course may also cover environmental policy and advocacy."
8,9,Introduction to Music Theory,"This course introduces students to the basic principles of music theory. Students will learn about notation, scales, chords, and harmony, as well as music analysis and ear training."
9,10,International Business Management,"This course covers the fundamentals of international business. Topics covered may include global trade, multinational corporations, foreign investment, and cultural differences in business practices. The course may also cover international marketing and finance."
10,11,Digital Photography,"This course teaches students the basics of digital photography. Students will learn about camera settings, composition, lighting, and post-processing, as well as how to use software such as Adobe Photoshop or Lightroom."
11,12,Philosophy of Mind and Consciousness,"This course explores philosophical questions related to the nature of mind and consciousness. Topics covered may include debates about free will, the self, and the relationship between mind and body. The course may also cover theories of perception, cognition, and emotion."
12,13,Applied Statistics,"This course covers statistical methods for analyzing data in various fields. Topics covered may include descriptive statistics, probability, hypothesis testing, regression analysis, and ANOVA. The course may also cover data visualization and statistical software such as R or SAS."
13,14,Social Media Marketing,"This course covers the principles and practices of marketing on social media platforms. Topics covered may include advertising, content creation"
14,15,Introduction to Sociology,"This course provides an introduction to the basic concepts and theories of sociology. Topics covered may include socialization, culture, social inequality, deviance, and social change. The course may also cover research methods used in sociology, such as surveys, experiments, and ethnography."
15,16,Financial Accounting,"This course covers the principles and practices of financial accounting. Students will learn about financial statements, journal entries, balance sheets, and income statements. The course may also cover financial analysis and auditing."
16,17,Art History,"This course provides an overview of art history from prehistoric times to the present day. Students will learn about different artistic movements and styles, as well as the social, political, and cultural contexts in which art was produced."
17,18,Introduction to Linguistics,"This course introduces students to the study of language. Topics covered may include the structure of language, the evolution of language, and the relationship between language and culture. The course may also cover language acquisition and language disorders."
18,19,Organizational Behavior,"This course examines the behavior of individuals and groups in organizational settings. Topics covered may include motivation, leadership, communication, teamwork, and organizational culture. The course may also cover conflict resolution and negotiation."
19,20,Elementary Spanish,"This course provides an introduction to the Spanish language. Students will learn basic grammar, vocabulary, and conversational skills. The course may also cover cultural aspects of Spanish-speaking countries."
20,21,Introduction to Philosophy,"This course provides an overview of the major philosophical questions and theories. Topics covered may include metaphysics, epistemology, ethics, and logic. The course may also cover the philosophy of science and the philosophy of religion."
21,22,Macroeconomics,"This course covers the principles of macroeconomics, including national income accounting, inflation, and unemployment. Students will learn about fiscal and monetary policy, as well as international trade and finance."
22,23,American Literature,"This course provides an overview of American literature from colonial times to the present day. Students will learn about different literary movements and genres, as well as the historical and cultural contexts in which the literature was produced."
23,24,Introduction to Web Development,"This course provides an introduction to web development. Students will learn about HTML, CSS, and JavaScript, as well as website design principles and web development frameworks."
24,25,Human Resource Management,"This course covers the principles and practices of human resource management. Topics covered may include recruitment, training, performance management, and employee relations. The course may also cover legal and ethical issues in human resource management."
25,26,Cognitive Psychology,"This course examines the cognitive processes underlying human behavior. Topics covered may include attention, perception, memory, language, and problem-solving. The course may also cover cognitive neuroscience and the study of brain function."
26,27,Microeconomics,"This course covers the principles of microeconomics, including consumer behavior, market structure, and pricing. Students will learn about supply and demand, market failures, and government intervention in markets."
27,28,Public Speaking,"This course teaches students how to communicate effectively in public speaking situations. Students will learn about speech organization, delivery techniques, and audience analysis. The course may also cover persuasive speaking and debate."
28,29,Environmental Science,"This course provides an overview of the scientific study of the environment. Topics covered may include ecosystems, biodiversity, climate change, and environmental policy. The course may also cover environmental ethics and sustainability."
